<!ELEMENT entrega (lote+)>
<!ELEMENT lote (pale+)>
<!ELEMENT pale (numcajas, contenido, peso, formamanipulacion)>
<!ELEMENT numcajas (#PCDATA)>
<!ELEMENT contenido (nombrecomponente, procedencia?, numserie, peso, unidades)>
<!ELEMENT nombrecomponente (#PCDATA)>
<!ELEMENT procedencia (pais*)>
<!ELEMENT pais (#PCDATA)>
<!ELEMENT numserie (#PCDATA)>
<!ELEMENT peso (#PCDATA)>
<!ELEMENT unidades (#PCDATA)>
<!ELEMENT formamanipulacion (#PCDATA)>